{
  "summary": "2 commit(s): docs: add HORIZONTAL to SYSTEMS.md; Merge pull request #96 from jonnysteedman683-wq/claude/systems-horizontal",
  "changes": [
    {
      "category": "DOCS",
      "title": "1 file(s) changed",
      "description": "Detected automatically from code: 1 file(s) changed.",
      "impact": "unclear (mechanical draft; not reviewed by the watcher)",
      "evidence": [
        {
          "sha": "f96af7e9b460f142ef6b9bffc0eb22824e413910",
          "path": "docs/SYSTEMS.md"
        }
      ],
      "permission": "n/a",
      "flags": []
    }
  ],
  "prs": [],
  "security_alerts": [],
  "breaking_changes": [],
  "open_questions": [
    "Mechanical draft (no draft service configured): descriptions come from computed capability changes and commit messages and were not reviewed by the watcher."
  ],
  "pr_previews": [],
  "escalation_reasons": [],
  "report_type": "repo_change_report",
  "seq": 90,
  "source_bot": "GROK-WATCHER",
  "target_bot": "CO-ORDINATOR-BOT",
  "repo": "jonnysteedman683-wq/Sebastian",
  "branch": "main",
  "range": {
    "from_sha": "490e59e6314f1c0d7da4890ad73665d92e0bc2c8",
    "to_sha": "f96af7e9b460f142ef6b9bffc0eb22824e413910"
  },
  "generated_at": "2026-10-30T11:33:05Z",
  "version": {
    "before": "0.1.0",
    "after": "0.1.0"
  },
  "ci_status": "unknown",
  "capability_inventory": {
    "tools": [
      "edit_file",
      "list_dir",
      "read_file",
      "run_command",
      "search_files",
      "write_file"
    ],
    "cli_commands": [
      "crosstest",
      "dashboard",
      "demo",
      "doctor",
      "evolve",
      "memory",
      "models",
      "redteam",
      "resume",
      "run",
      "scar",
      "show",
      "traces",
      "trust",
      "undo",
      "version"
    ],
    "llm_backends": [
      "anthropic",
      "openai_compat",
      "scripted"
    ],
    "default_model": "claude-sonnet-5-5"
  },
  "capability_diff": {
    "added": [],
    "removed": [],
    "changed": []
  },
  "risk_score": 0,
  "escalate": false,
  "priority": "LOW",
  "signature": "51668a6c01ac320c073bc8d3dc2d8a7121cc4ae54b4e5621eb45aa1ccf7a179f"
}
