{
  "summary": "2 commit(s): fix(tests): remove unused noqa S310 flagged by RUF100; Merge pull request #104 from jonnysteedman683-wq/fix/ruff-unused-noqa",
  "changes": [
    {
      "category": "QUALITY",
      "title": "1 file(s) changed",
      "description": "Detected automatically from code: 1 file(s) changed.",
      "impact": "unclear (mechanical draft; not reviewed by the watcher)",
      "evidence": [
        {
          "sha": "b08fb5714ded824c017f8f555b93823a1aabf0b4",
          "path": "tests/test_api_key_scope.py"
        }
      ],
      "permission": "n/a",
      "flags": []
    }
  ],
  "prs": [],
  "security_alerts": [],
  "breaking_changes": [],
  "open_questions": [
    "Mechanical draft (no draft service configured): descriptions come from computed capability changes and commit messages and were not reviewed by the watcher."
  ],
  "pr_previews": [],
  "escalation_reasons": [],
  "report_type": "repo_change_report",
  "seq": 97,
  "source_bot": "GROK-WATCHER",
  "target_bot": "CO-ORDINATOR-BOT",
  "repo": "jonnysteedman683-wq/Sebastian",
  "branch": "main",
  "range": {
    "from_sha": "fddc8ad97c56905aaae58f91e8d10aaec9f541c3",
    "to_sha": "b08fb5714ded824c017f8f555b93823a1aabf0b4"
  },
  "generated_at": "2026-10-30T14:17:20Z",
  "version": {
    "before": "0.1.0",
    "after": "0.1.0"
  },
  "ci_status": "unknown",
  "capability_inventory": {
    "tools": [
      "edit_file",
      "list_dir",
      "read_file",
      "run_command",
      "search_files",
      "write_file"
    ],
    "cli_commands": [
      "crosstest",
      "dashboard",
      "demo",
      "doctor",
      "evolve",
      "memory",
      "models",
      "redteam",
      "resume",
      "run",
      "scar",
      "show",
      "traces",
      "trust",
      "undo",
      "version"
    ],
    "llm_backends": [
      "anthropic",
      "openai_compat",
      "scripted"
    ],
    "default_model": "claude-sonnet-5-5"
  },
  "capability_diff": {
    "added": [],
    "removed": [],
    "changed": []
  },
  "risk_score": 0,
  "escalate": false,
  "priority": "LOW",
  "signature": "d4837ff4bf4b912811ddce31d5902370386630ff3c1e71e474e40a13bb2dd4b4"
}
