{
  "summary": "2 commit(s): refactor: extract shared stdlib-only Gauntlet core (B76); Merge pull request #109 from jonnysteedman683-wq/refactor/b76-shared-gauntlet-core",
  "changes": [
    {
      "category": "ABILITY_CHANGE",
      "title": "6 file(s) changed",
      "description": "Detected automatically from code: 6 file(s) changed.",
      "impact": "unclear (mechanical draft; not reviewed by the watcher)",
      "evidence": [
        {
          "sha": "d485da4d2990114ab4fb3594995d31d77a42846d",
          "path": "CHANGELOG.md"
        }
      ],
      "permission": "n/a",
      "flags": []
    }
  ],
  "prs": [],
  "security_alerts": [],
  "breaking_changes": [],
  "open_questions": [
    "Mechanical draft (no draft service configured): descriptions come from computed capability changes and commit messages and were not reviewed by the watcher."
  ],
  "pr_previews": [],
  "escalation_reasons": [],
  "report_type": "repo_change_report",
  "seq": 109,
  "source_bot": "GROK-WATCHER",
  "target_bot": "CO-ORDINATOR-BOT",
  "repo": "jonnysteedman683-wq/Sebastian",
  "branch": "main",
  "range": {
    "from_sha": "62fbf677fc3d7229415e25ef6814efe1509593d2",
    "to_sha": "d485da4d2990114ab4fb3594995d31d77a42846d"
  },
  "generated_at": "2026-10-31T11:35:17Z",
  "version": {
    "before": "0.1.0",
    "after": "0.1.0"
  },
  "ci_status": "unknown",
  "capability_inventory": {
    "tools": [
      "edit_file",
      "list_dir",
      "read_file",
      "run_command",
      "search_files",
      "write_file"
    ],
    "cli_commands": [
      "crosstest",
      "dashboard",
      "demo",
      "doctor",
      "evolve",
      "memory",
      "models",
      "redteam",
      "resume",
      "run",
      "scar",
      "show",
      "traces",
      "trust",
      "undo",
      "unisync",
      "version"
    ],
    "llm_backends": [
      "anthropic",
      "openai_compat",
      "scripted"
    ],
    "default_model": "claude-sonnet-5-5"
  },
  "capability_diff": {
    "added": [],
    "removed": [],
    "changed": []
  },
  "risk_score": 0,
  "escalate": false,
  "priority": "NORMAL",
  "signature": "886c8e69c0c315f388c263d79b7f2b3e9284993423645f529c0f39bf628e12a7"
}
