{
  "summary": "4 commit(s): feat: sebastian crosstest - run each agent's suite against every agent (B73); docs: map entry for crosstest (B73); Merge remote-tracking branch 'origin/main' into claude/b73-crosstest; Merge pull request #76 from jonnysteedman683-wq/claude/b73-crosstest",
  "changes": [
    {
      "category": "NEW_FEATURE",
      "title": "New CLI command crosstest",
      "description": "Detected automatically from code: New CLI command crosstest.",
      "impact": "unclear (mechanical draft; not reviewed by the watcher)",
      "evidence": [
        {
          "sha": "8331ea92b64b70c4b7318425b446ea2b0c9be2f9",
          "path": "src/sebastian/cli.py"
        }
      ],
      "permission": "n/a",
      "flags": []
    }
  ],
  "prs": [],
  "security_alerts": [],
  "breaking_changes": [],
  "open_questions": [
    "Mechanical draft (no draft service configured): descriptions come from computed capability changes and commit messages and were not reviewed by the watcher."
  ],
  "pr_previews": [],
  "escalation_reasons": [],
  "report_type": "repo_change_report",
  "seq": 80,
  "source_bot": "GROK-WATCHER",
  "target_bot": "CO-ORDINATOR-BOT",
  "repo": "jonnysteedman683-wq/Sebastian",
  "branch": "main",
  "range": {
    "from_sha": "6b760aa272237d85e62804385d06dcd4814daa42",
    "to_sha": "8331ea92b64b70c4b7318425b446ea2b0c9be2f9"
  },
  "generated_at": "2026-10-26T13:48:46Z",
  "version": {
    "before": "0.1.0",
    "after": "0.1.0"
  },
  "ci_status": "unknown",
  "capability_inventory": {
    "tools": [
      "edit_file",
      "list_dir",
      "read_file",
      "run_command",
      "search_files",
      "write_file"
    ],
    "cli_commands": [
      "crosstest",
      "dashboard",
      "demo",
      "doctor",
      "evolve",
      "memory",
      "models",
      "redteam",
      "resume",
      "run",
      "scar",
      "show",
      "traces",
      "trust",
      "undo",
      "version"
    ],
    "llm_backends": [
      "anthropic",
      "openai_compat",
      "scripted"
    ],
    "default_model": "claude-sonnet-5-5"
  },
  "capability_diff": {
    "added": [
      "cli: crosstest"
    ],
    "removed": [],
    "changed": []
  },
  "risk_score": 0,
  "escalate": false,
  "priority": "NORMAL",
  "signature": "dc0590096b8f1cf54a9f9fd5ac6bbce870f8b4cd87549611caf868c7e73fec1f"
}
