{
  "summary": "2 commit(s): Merge pull request #70 from jonnysteedman683-wq/ccr-f52e73f0-pdedjx; Merge pull request #71 from jonnysteedman683-wq/ccr-f52e73f0-pdedjx",
  "changes": [
    {
      "category": "NEW_FEATURE",
      "title": "New CLI command doctor",
      "description": "Detected automatically from code: New CLI command doctor.",
      "impact": "unclear (mechanical draft; not reviewed by the watcher)",
      "evidence": [
        {
          "sha": "adfa0e9a60b369715accc8ecf1dfecd292871e41",
          "path": "src/sebastian/cli.py"
        }
      ],
      "permission": "n/a",
      "flags": []
    }
  ],
  "prs": [],
  "security_alerts": [],
  "breaking_changes": [],
  "open_questions": [
    "Mechanical draft (no draft service configured): descriptions come from computed capability changes and commit messages and were not reviewed by the watcher."
  ],
  "pr_previews": [],
  "escalation_reasons": [],
  "report_type": "repo_change_report",
  "seq": 72,
  "source_bot": "GROK-WATCHER",
  "target_bot": "CO-ORDINATOR-BOT",
  "repo": "jonnysteedman683-wq/Sebastian",
  "branch": "main",
  "range": {
    "from_sha": "5ccdafb8deddac66430060ddf6964176aeeb3e56",
    "to_sha": "adfa0e9a60b369715accc8ecf1dfecd292871e41"
  },
  "generated_at": "2026-10-24T06:02:02Z",
  "version": {
    "before": "0.1.0",
    "after": "0.1.0"
  },
  "ci_status": "unknown",
  "capability_inventory": {
    "tools": [
      "edit_file",
      "list_dir",
      "read_file",
      "run_command",
      "search_files",
      "write_file"
    ],
    "cli_commands": [
      "dashboard",
      "demo",
      "doctor",
      "evolve",
      "memory",
      "models",
      "redteam",
      "resume",
      "run",
      "scar",
      "show",
      "traces",
      "trust",
      "undo",
      "version"
    ],
    "llm_backends": [
      "anthropic",
      "openai_compat",
      "scripted"
    ],
    "default_model": "claude-sonnet-5-5"
  },
  "capability_diff": {
    "added": [
      "cli: doctor"
    ],
    "removed": [],
    "changed": []
  },
  "risk_score": 0,
  "escalate": false,
  "priority": "NORMAL",
  "signature": "2a7f33fb4280da2a1b21f4ccc4329fd5afb7612d77c501a940135fbf81498f31"
}
