{
  "summary": "No changes in last 24h; head = fcb36ed",
  "changes": [],
  "prs": [],
  "security_alerts": [],
  "breaking_changes": [],
  "open_questions": [],
  "pr_previews": [],
  "escalation_reasons": [],
  "report_type": "repo_change_report",
  "seq": 82,
  "source_bot": "GROK-WATCHER",
  "target_bot": "CO-ORDINATOR-BOT",
  "repo": "jonnysteedman683-wq/Sebastian",
  "branch": "main",
  "range": {
    "from_sha": "fcb36ed4e7c0910f541c5378418a41298b1a5a9f",
    "to_sha": "fcb36ed4e7c0910f541c5378418a41298b1a5a9f"
  },
  "generated_at": "2026-10-27T01:01:42Z",
  "version": {
    "before": "0.1.0",
    "after": "0.1.0"
  },
  "ci_status": "unknown",
  "capability_inventory": {
    "tools": [
      "edit_file",
      "list_dir",
      "read_file",
      "run_command",
      "search_files",
      "write_file"
    ],
    "cli_commands": [
      "crosstest",
      "dashboard",
      "demo",
      "doctor",
      "evolve",
      "memory",
      "models",
      "redteam",
      "resume",
      "run",
      "scar",
      "show",
      "traces",
      "trust",
      "undo",
      "version"
    ],
    "llm_backends": [
      "anthropic",
      "openai_compat",
      "scripted"
    ],
    "default_model": "claude-sonnet-5-5"
  },
  "capability_diff": {
    "added": [],
    "removed": [],
    "changed": []
  },
  "risk_score": 0,
  "escalate": false,
  "priority": "LOW",
  "signature": "dafc2bcd1230386aa4bdaa520c170aef3df1934811eaeedfad9fb38621a3a073"
}
