{
  "summary": "2 commit(s): fix: no stale bytecode in agent commands (B43); Merge pull request #49 from jonnysteedman683-wq/sebastian/daily-B43-bytecode-4608673948473475773",
  "changes": [
    {
      "category": "ABILITY_CHANGE",
      "title": "4 file(s) changed",
      "description": "Detected automatically from code: 4 file(s) changed.",
      "impact": "unclear (mechanical draft; not reviewed by the watcher)",
      "evidence": [
        {
          "sha": "eaf694b72084092ed64a9f0fea3f87c000f559f1",
          "path": "CHANGELOG.md"
        }
      ],
      "permission": "n/a",
      "flags": []
    }
  ],
  "prs": [],
  "security_alerts": [],
  "breaking_changes": [],
  "open_questions": [
    "Mechanical draft (no draft service configured): descriptions come from computed capability changes and commit messages and were not reviewed by the watcher."
  ],
  "pr_previews": [],
  "escalation_reasons": [],
  "report_type": "repo_change_report",
  "seq": 38,
  "source_bot": "GROK-WATCHER",
  "target_bot": "CO-ORDINATOR-BOT",
  "repo": "jonnysteedman683-wq/Sebastian",
  "branch": "main",
  "range": {
    "from_sha": "07f3eab70011c8f133f131e02b2f50b5097ddce8",
    "to_sha": "eaf694b72084092ed64a9f0fea3f87c000f559f1"
  },
  "generated_at": "2026-10-20T12:38:04Z",
  "version": {
    "before": "0.1.0",
    "after": "0.1.0"
  },
  "ci_status": "unknown",
  "capability_inventory": {
    "tools": [
      "edit_file",
      "list_dir",
      "read_file",
      "run_command",
      "search_files",
      "write_file"
    ],
    "cli_commands": [
      "dashboard",
      "demo",
      "evolve",
      "models",
      "redteam",
      "resume",
      "run",
      "scar",
      "traces",
      "undo",
      "version"
    ],
    "llm_backends": [
      "anthropic",
      "openai_compat",
      "scripted"
    ],
    "default_model": "claude-sonnet-5-5"
  },
  "capability_diff": {
    "added": [],
    "removed": [],
    "changed": []
  },
  "risk_score": 0,
  "escalate": false,
  "priority": "NORMAL",
  "signature": "d487f315938565a5480adc1be5c6eaa79d08d56b32f232f1068382116eac5b88"
}
