{
  "summary": "3 commit(s): feat: sandbox run_command by default when bubblewrap works (B19); docs: reword sandbox residual risk for the new default (B19); Merge pull request #25 from jonnysteedman683-wq/claude/sandbox-default",
  "changes": [
    {
      "category": "ABILITY_CHANGE",
      "title": "8 file(s) changed",
      "description": "Detected automatically from code: 8 file(s) changed.",
      "impact": "unclear (mechanical draft; not reviewed by the watcher)",
      "evidence": [
        {
          "sha": "0441f5061fbe67499a2aa037cd1b684a4a63c6e7",
          "path": "CHANGELOG.md"
        }
      ],
      "permission": "n/a",
      "flags": []
    }
  ],
  "prs": [],
  "security_alerts": [],
  "breaking_changes": [],
  "open_questions": [
    "Mechanical draft (no draft service configured): descriptions come from computed capability changes and commit messages and were not reviewed by the watcher."
  ],
  "pr_previews": [],
  "escalation_reasons": [],
  "report_type": "repo_change_report",
  "seq": 21,
  "source_bot": "GROK-WATCHER",
  "target_bot": "CO-ORDINATOR-BOT",
  "repo": "jonnysteedman683-wq/Sebastian",
  "branch": "main",
  "range": {
    "from_sha": "095f60dd92dc9e73143e6ddc494e003730a22011",
    "to_sha": "0441f5061fbe67499a2aa037cd1b684a4a63c6e7"
  },
  "generated_at": "2026-10-19T02:46:18Z",
  "version": {
    "before": "0.1.0",
    "after": "0.1.0"
  },
  "ci_status": "unknown",
  "capability_inventory": {
    "tools": [
      "edit_file",
      "list_dir",
      "read_file",
      "run_command",
      "search_files",
      "write_file"
    ],
    "cli_commands": [
      "dashboard",
      "demo",
      "evolve",
      "redteam",
      "resume",
      "run",
      "scar",
      "traces",
      "undo",
      "version"
    ],
    "llm_backends": [
      "anthropic",
      "scripted"
    ],
    "default_model": "claude-sonnet-5-5"
  },
  "capability_diff": {
    "added": [],
    "removed": [],
    "changed": []
  },
  "risk_score": 0,
  "escalate": false,
  "priority": "NORMAL",
  "signature": "1ab6b9515a3f5012a7c2790b4561980788fd391bf7809df7f9af493dd2b57f87"
}
