{
  "summary": "3 commit(s): docs: MIT licence (B12); Merge branch 'main' into claude/b12-mit-licence; Merge pull request #29 from jonnysteedman683-wq/claude/b12-mit-licence",
  "changes": [
    {
      "category": "ABILITY_CHANGE",
      "title": "6 file(s) changed",
      "description": "Detected automatically from code: 6 file(s) changed.",
      "impact": "unclear (mechanical draft; not reviewed by the watcher)",
      "evidence": [
        {
          "sha": "f906a1a53426517603db1ee41d1ab99fb5165a66",
          "path": "CHANGELOG.md"
        }
      ],
      "permission": "n/a",
      "flags": []
    }
  ],
  "prs": [],
  "security_alerts": [],
  "breaking_changes": [],
  "open_questions": [
    "Mechanical draft (no draft service configured): descriptions come from computed capability changes and commit messages and were not reviewed by the watcher."
  ],
  "pr_previews": [],
  "escalation_reasons": [],
  "report_type": "repo_change_report",
  "seq": 25,
  "source_bot": "GROK-WATCHER",
  "target_bot": "CO-ORDINATOR-BOT",
  "repo": "jonnysteedman683-wq/Sebastian",
  "branch": "main",
  "range": {
    "from_sha": "9fb149f65783be5d418cc25b23ddb715911271ec",
    "to_sha": "f906a1a53426517603db1ee41d1ab99fb5165a66"
  },
  "generated_at": "2026-10-19T07:39:48Z",
  "version": {
    "before": "0.1.0",
    "after": "0.1.0"
  },
  "ci_status": "unknown",
  "capability_inventory": {
    "tools": [
      "edit_file",
      "list_dir",
      "read_file",
      "run_command",
      "search_files",
      "write_file"
    ],
    "cli_commands": [
      "dashboard",
      "demo",
      "evolve",
      "redteam",
      "resume",
      "run",
      "scar",
      "traces",
      "undo",
      "version"
    ],
    "llm_backends": [
      "anthropic",
      "scripted"
    ],
    "default_model": "claude-sonnet-5-5"
  },
  "capability_diff": {
    "added": [],
    "removed": [],
    "changed": []
  },
  "risk_score": 0,
  "escalate": false,
  "priority": "NORMAL",
  "signature": "c92e9116f3c60b9d9e39a7ff62bbe40cbf0d494a5bdad8aa914cbc2783d8fc55"
}
