{
  "summary": "3 commit(s): docs: run checks via python -m in CLAUDE.md; docs: run checks via python -m in AGENTS.md and README; Merge pull request #73 from jonnysteedman683-wq/ccr-855631e1-6onsr0",
  "changes": [
    {
      "category": "DOCS",
      "title": "3 file(s) changed",
      "description": "Detected automatically from code: 3 file(s) changed.",
      "impact": "unclear (mechanical draft; not reviewed by the watcher)",
      "evidence": [
        {
          "sha": "354681cc286762d7db3f9c5d84392d436dc23d6a",
          "path": "AGENTS.md"
        }
      ],
      "permission": "n/a",
      "flags": []
    }
  ],
  "prs": [],
  "security_alerts": [],
  "breaking_changes": [],
  "open_questions": [
    "Mechanical draft (no draft service configured): descriptions come from computed capability changes and commit messages and were not reviewed by the watcher."
  ],
  "pr_previews": [],
  "escalation_reasons": [
    "watch tooling or report contract changed: AGENTS.md, CLAUDE.md"
  ],
  "report_type": "repo_change_report",
  "seq": 77,
  "source_bot": "GROK-WATCHER",
  "target_bot": "CO-ORDINATOR-BOT",
  "repo": "jonnysteedman683-wq/Sebastian",
  "branch": "main",
  "range": {
    "from_sha": "13944401e53f8d739df5927647b896a07d2a444d",
    "to_sha": "354681cc286762d7db3f9c5d84392d436dc23d6a"
  },
  "generated_at": "2026-10-26T10:19:26Z",
  "version": {
    "before": "0.1.0",
    "after": "0.1.0"
  },
  "ci_status": "unknown",
  "capability_inventory": {
    "tools": [
      "edit_file",
      "list_dir",
      "read_file",
      "run_command",
      "search_files",
      "write_file"
    ],
    "cli_commands": [
      "dashboard",
      "demo",
      "doctor",
      "evolve",
      "memory",
      "models",
      "redteam",
      "resume",
      "run",
      "scar",
      "show",
      "traces",
      "trust",
      "undo",
      "version"
    ],
    "llm_backends": [
      "anthropic",
      "openai_compat",
      "scripted"
    ],
    "default_model": "claude-sonnet-5-5"
  },
  "capability_diff": {
    "added": [],
    "removed": [],
    "changed": []
  },
  "risk_score": 3,
  "escalate": true,
  "priority": "HIGH",
  "signature": "9e5e57150878eaa8949a7a3732a97f7ef42d40c3d7f7ed704f8e961568ab8b4a"
}
