{
  "summary": "5 commit(s): feat: cost tracking and a per-run dollar limit (B40); Merge main into claude/b40-cost-tracking; Merge main into claude/b40-cost-tracking; fix: price the models leaderboard's clients too (B40); Merge pull request #39 from jonnysteedman683-wq/claude/b40-cost-tracking",
  "changes": [
    {
      "category": "ABILITY_CHANGE",
      "title": "14 file(s) changed",
      "description": "Detected automatically from code: 14 file(s) changed.",
      "impact": "unclear (mechanical draft; not reviewed by the watcher)",
      "evidence": [
        {
          "sha": "2cbe0fa636341edae62fa4bfdfa3663366b6369b",
          "path": "CHANGELOG.md"
        }
      ],
      "permission": "n/a",
      "flags": []
    }
  ],
  "prs": [],
  "security_alerts": [],
  "breaking_changes": [],
  "open_questions": [
    "Mechanical draft (no draft service configured): descriptions come from computed capability changes and commit messages and were not reviewed by the watcher."
  ],
  "pr_previews": [],
  "escalation_reasons": [],
  "report_type": "repo_change_report",
  "seq": 35,
  "source_bot": "GROK-WATCHER",
  "target_bot": "CO-ORDINATOR-BOT",
  "repo": "jonnysteedman683-wq/Sebastian",
  "branch": "main",
  "range": {
    "from_sha": "2a5591abdb308be89dc277e2838f74777e43ea1e",
    "to_sha": "2cbe0fa636341edae62fa4bfdfa3663366b6369b"
  },
  "generated_at": "2026-10-19T14:27:43Z",
  "version": {
    "before": "0.1.0",
    "after": "0.1.0"
  },
  "ci_status": "unknown",
  "capability_inventory": {
    "tools": [
      "edit_file",
      "list_dir",
      "read_file",
      "run_command",
      "search_files",
      "write_file"
    ],
    "cli_commands": [
      "dashboard",
      "demo",
      "evolve",
      "models",
      "redteam",
      "resume",
      "run",
      "scar",
      "traces",
      "undo",
      "version"
    ],
    "llm_backends": [
      "anthropic",
      "openai_compat",
      "scripted"
    ],
    "default_model": "claude-sonnet-5-5"
  },
  "capability_diff": {
    "added": [],
    "removed": [],
    "changed": []
  },
  "risk_score": 0,
  "escalate": false,
  "priority": "NORMAL",
  "signature": "b1bd9345cf05674f8987585cf29c5c019b1f0093cada4a379004af73d024ccd9"
}
