{
  "summary": "2 commit(s): test: add tests for args_digest; Merge pull request #97 from jonnysteedman683-wq/sebastian/test-args-digest-10836315479625051697",
  "changes": [
    {
      "category": "QUALITY",
      "title": "1 file(s) changed",
      "description": "Detected automatically from code: 1 file(s) changed.",
      "impact": "unclear (mechanical draft; not reviewed by the watcher)",
      "evidence": [
        {
          "sha": "36024f09fe3bff95706d13d5c3a7506a66ba8967",
          "path": "tests/test_approval_review.py"
        }
      ],
      "permission": "n/a",
      "flags": []
    }
  ],
  "prs": [],
  "security_alerts": [],
  "breaking_changes": [],
  "open_questions": [
    "Mechanical draft (no draft service configured): descriptions come from computed capability changes and commit messages and were not reviewed by the watcher."
  ],
  "pr_previews": [],
  "escalation_reasons": [],
  "report_type": "repo_change_report",
  "seq": 91,
  "source_bot": "GROK-WATCHER",
  "target_bot": "CO-ORDINATOR-BOT",
  "repo": "jonnysteedman683-wq/Sebastian",
  "branch": "main",
  "range": {
    "from_sha": "f96af7e9b460f142ef6b9bffc0eb22824e413910",
    "to_sha": "36024f09fe3bff95706d13d5c3a7506a66ba8967"
  },
  "generated_at": "2026-10-30T11:33:55Z",
  "version": {
    "before": "0.1.0",
    "after": "0.1.0"
  },
  "ci_status": "unknown",
  "capability_inventory": {
    "tools": [
      "edit_file",
      "list_dir",
      "read_file",
      "run_command",
      "search_files",
      "write_file"
    ],
    "cli_commands": [
      "crosstest",
      "dashboard",
      "demo",
      "doctor",
      "evolve",
      "memory",
      "models",
      "redteam",
      "resume",
      "run",
      "scar",
      "show",
      "traces",
      "trust",
      "undo",
      "version"
    ],
    "llm_backends": [
      "anthropic",
      "openai_compat",
      "scripted"
    ],
    "default_model": "claude-sonnet-5-5"
  },
  "capability_diff": {
    "added": [],
    "removed": [],
    "changed": []
  },
  "risk_score": 0,
  "escalate": false,
  "priority": "LOW",
  "signature": "f4c693799a0679ecf1b9693b5bef1178522f325be0b648fe6f44515e0bf66d46"
}
