{
  "summary": "8 commit(s): fix(evals): P1-20 make the B38 behaviour checks ungameable; Merge main into claude/p1-20-ungameable-checks; Merge main into claude/p1-20-ungameable-checks; Merge main into claude/p1-20-ungameable-checks; Merge origin/main into claude/p1-20-ungameable-checks; Merge origin/main into claude/p1-20-ungameable-checks; Merge branch 'main' into claude/p1-20-ungameable-checks; Merge pull request #47 from jonnysteedman683-wq/claude/p1-20-ungameable-checks",
  "changes": [
    {
      "category": "ABILITY_CHANGE",
      "title": "7 file(s) changed",
      "description": "Detected automatically from code: 7 file(s) changed.",
      "impact": "unclear (mechanical draft; not reviewed by the watcher)",
      "evidence": [
        {
          "sha": "13b2d800caa05e57f158cf7f6c89c612a99d8897",
          "path": "CHANGELOG.md"
        }
      ],
      "permission": "n/a",
      "flags": []
    }
  ],
  "prs": [],
  "security_alerts": [],
  "breaking_changes": [],
  "open_questions": [
    "Mechanical draft (no draft service configured): descriptions come from computed capability changes and commit messages and were not reviewed by the watcher."
  ],
  "pr_previews": [],
  "escalation_reasons": [],
  "report_type": "repo_change_report",
  "seq": 49,
  "source_bot": "GROK-WATCHER",
  "target_bot": "CO-ORDINATOR-BOT",
  "repo": "jonnysteedman683-wq/Sebastian",
  "branch": "main",
  "range": {
    "from_sha": "a0aa69f0a75fb8656d2df637da0e2d9de1149c31",
    "to_sha": "13b2d800caa05e57f158cf7f6c89c612a99d8897"
  },
  "generated_at": "2026-10-21T00:46:12Z",
  "version": {
    "before": "0.1.0",
    "after": "0.1.0"
  },
  "ci_status": "unknown",
  "capability_inventory": {
    "tools": [
      "edit_file",
      "list_dir",
      "read_file",
      "run_command",
      "search_files",
      "write_file"
    ],
    "cli_commands": [
      "dashboard",
      "demo",
      "evolve",
      "models",
      "redteam",
      "resume",
      "run",
      "scar",
      "show",
      "traces",
      "undo",
      "version"
    ],
    "llm_backends": [
      "anthropic",
      "openai_compat",
      "scripted"
    ],
    "default_model": "claude-sonnet-5-5"
  },
  "capability_diff": {
    "added": [],
    "removed": [],
    "changed": []
  },
  "risk_score": 0,
  "escalate": false,
  "priority": "NORMAL",
  "signature": "de8e85ee942eb9c78890619708b519ed1f5a2ed190e5e1a0e59503262b7449b1"
}
