{
  "summary": "2 commit(s): chore: union-merge CHANGELOG.md so parallel PRs don't conflict (B44); Merge pull request #55 from jonnysteedman683-wq/claude/changelog-union-merge",
  "changes": [
    {
      "category": "ABILITY_CHANGE",
      "title": "4 file(s) changed",
      "description": "Detected automatically from code: 4 file(s) changed.",
      "impact": "unclear (mechanical draft; not reviewed by the watcher)",
      "evidence": [
        {
          "sha": "7741b547579e01f08a114f13e1dffbc8624bac18",
          "path": ".gitattributes"
        }
      ],
      "permission": "n/a",
      "flags": []
    }
  ],
  "prs": [],
  "security_alerts": [],
  "breaking_changes": [],
  "open_questions": [
    "Mechanical draft (no draft service configured): descriptions come from computed capability changes and commit messages and were not reviewed by the watcher."
  ],
  "pr_previews": [],
  "escalation_reasons": [],
  "report_type": "repo_change_report",
  "seq": 44,
  "source_bot": "GROK-WATCHER",
  "target_bot": "CO-ORDINATOR-BOT",
  "repo": "jonnysteedman683-wq/Sebastian",
  "branch": "main",
  "range": {
    "from_sha": "1d0bc821aa34691ffda9fc0e5c099793eb008620",
    "to_sha": "7741b547579e01f08a114f13e1dffbc8624bac18"
  },
  "generated_at": "2026-10-20T14:45:06Z",
  "version": {
    "before": "0.1.0",
    "after": "0.1.0"
  },
  "ci_status": "unknown",
  "capability_inventory": {
    "tools": [
      "edit_file",
      "list_dir",
      "read_file",
      "run_command",
      "search_files",
      "write_file"
    ],
    "cli_commands": [
      "dashboard",
      "demo",
      "evolve",
      "models",
      "redteam",
      "resume",
      "run",
      "scar",
      "show",
      "traces",
      "undo",
      "version"
    ],
    "llm_backends": [
      "anthropic",
      "openai_compat",
      "scripted"
    ],
    "default_model": "claude-sonnet-5-5"
  },
  "capability_diff": {
    "added": [],
    "removed": [],
    "changed": []
  },
  "risk_score": 0,
  "escalate": false,
  "priority": "NORMAL",
  "signature": "5cd91bff921686ea2b0d24742eba6a56af0ed9cd614c678db823b373dcd83f95"
}
