{
  "summary": "3 commit(s): feat: sebastian models leaderboard across backends (B39); Merge main into claude/b39-models-leaderboard; Merge pull request #38 from jonnysteedman683-wq/claude/b39-models-leaderboard",
  "changes": [
    {
      "category": "NEW_FEATURE",
      "title": "New CLI command models",
      "description": "Detected automatically from code: New CLI command models.",
      "impact": "unclear (mechanical draft; not reviewed by the watcher)",
      "evidence": [
        {
          "sha": "2a5591abdb308be89dc277e2838f74777e43ea1e",
          "path": "src/sebastian/cli.py"
        }
      ],
      "permission": "n/a",
      "flags": []
    }
  ],
  "prs": [],
  "security_alerts": [],
  "breaking_changes": [],
  "open_questions": [
    "Mechanical draft (no draft service configured): descriptions come from computed capability changes and commit messages and were not reviewed by the watcher."
  ],
  "pr_previews": [],
  "escalation_reasons": [],
  "report_type": "repo_change_report",
  "seq": 34,
  "source_bot": "GROK-WATCHER",
  "target_bot": "CO-ORDINATOR-BOT",
  "repo": "jonnysteedman683-wq/Sebastian",
  "branch": "main",
  "range": {
    "from_sha": "45f3a5fe71cad9d054445b12d5f855ac35476275",
    "to_sha": "2a5591abdb308be89dc277e2838f74777e43ea1e"
  },
  "generated_at": "2026-10-19T13:20:55Z",
  "version": {
    "before": "0.1.0",
    "after": "0.1.0"
  },
  "ci_status": "unknown",
  "capability_inventory": {
    "tools": [
      "edit_file",
      "list_dir",
      "read_file",
      "run_command",
      "search_files",
      "write_file"
    ],
    "cli_commands": [
      "dashboard",
      "demo",
      "evolve",
      "models",
      "redteam",
      "resume",
      "run",
      "scar",
      "traces",
      "undo",
      "version"
    ],
    "llm_backends": [
      "anthropic",
      "openai_compat",
      "scripted"
    ],
    "default_model": "claude-sonnet-5-5"
  },
  "capability_diff": {
    "added": [
      "cli: models"
    ],
    "removed": [],
    "changed": []
  },
  "risk_score": 0,
  "escalate": false,
  "priority": "NORMAL",
  "signature": "355840306f8543a667fc8e543b5efe3cd70205b1b6c7f19f222e021a8e1dc407"
}
