{
  "summary": "2 commit(s): refactor: optimize membership check in trust.py; Merge pull request #87 from jonnysteedman683-wq/sebastian/perf-trust-4601972703219655208",
  "changes": [
    {
      "category": "ABILITY_CHANGE",
      "title": "1 file(s) changed",
      "description": "Detected automatically from code: 1 file(s) changed.",
      "impact": "unclear (mechanical draft; not reviewed by the watcher)",
      "evidence": [
        {
          "sha": "d7af1c26b5b63e01b98346482ed9849877a669ed",
          "path": "src/sebastian/trust.py"
        }
      ],
      "permission": "n/a",
      "flags": []
    }
  ],
  "prs": [],
  "security_alerts": [],
  "breaking_changes": [],
  "open_questions": [
    "Mechanical draft (no draft service configured): descriptions come from computed capability changes and commit messages and were not reviewed by the watcher."
  ],
  "pr_previews": [],
  "escalation_reasons": [],
  "report_type": "repo_change_report",
  "seq": 104,
  "source_bot": "GROK-WATCHER",
  "target_bot": "CO-ORDINATOR-BOT",
  "repo": "jonnysteedman683-wq/Sebastian",
  "branch": "main",
  "range": {
    "from_sha": "9d3c5d6af3f22115fea4474d25ad5ae68874ea94",
    "to_sha": "d7af1c26b5b63e01b98346482ed9849877a669ed"
  },
  "generated_at": "2026-10-30T15:18:33Z",
  "version": {
    "before": "0.1.0",
    "after": "0.1.0"
  },
  "ci_status": "unknown",
  "capability_inventory": {
    "tools": [
      "edit_file",
      "list_dir",
      "read_file",
      "run_command",
      "search_files",
      "write_file"
    ],
    "cli_commands": [
      "crosstest",
      "dashboard",
      "demo",
      "doctor",
      "evolve",
      "memory",
      "models",
      "redteam",
      "resume",
      "run",
      "scar",
      "show",
      "traces",
      "trust",
      "undo",
      "version"
    ],
    "llm_backends": [
      "anthropic",
      "openai_compat",
      "scripted"
    ],
    "default_model": "claude-sonnet-5-5"
  },
  "capability_diff": {
    "added": [],
    "removed": [],
    "changed": []
  },
  "risk_score": 0,
  "escalate": false,
  "priority": "NORMAL",
  "signature": "727e549af81c45c3fa08aa8821b526e7b9fadd0a2803863a14bb7bd269b1a9e4"
}
