{
  "summary": "3 commit(s): perf(memory): optimize type check for timestamp membership; Merge branch 'main' into jules-5977072735539981538-6e3a8a9e; Merge pull request #98 from jonnysteedman683-wq/jules-5977072735539981538-6e3a8a9e",
  "changes": [
    {
      "category": "ABILITY_CHANGE",
      "title": "1 file(s) changed",
      "description": "Detected automatically from code: 1 file(s) changed.",
      "impact": "unclear (mechanical draft; not reviewed by the watcher)",
      "evidence": [
        {
          "sha": "179d08e1b4b266ce56bc3dd20483a7fda8da5929",
          "path": "src/sebastian/memory.py"
        }
      ],
      "permission": "n/a",
      "flags": []
    }
  ],
  "prs": [],
  "security_alerts": [],
  "breaking_changes": [],
  "open_questions": [
    "Mechanical draft (no draft service configured): descriptions come from computed capability changes and commit messages and were not reviewed by the watcher."
  ],
  "pr_previews": [],
  "escalation_reasons": [],
  "report_type": "repo_change_report",
  "seq": 92,
  "source_bot": "GROK-WATCHER",
  "target_bot": "CO-ORDINATOR-BOT",
  "repo": "jonnysteedman683-wq/Sebastian",
  "branch": "main",
  "range": {
    "from_sha": "36024f09fe3bff95706d13d5c3a7506a66ba8967",
    "to_sha": "179d08e1b4b266ce56bc3dd20483a7fda8da5929"
  },
  "generated_at": "2026-10-30T11:34:55Z",
  "version": {
    "before": "0.1.0",
    "after": "0.1.0"
  },
  "ci_status": "unknown",
  "capability_inventory": {
    "tools": [
      "edit_file",
      "list_dir",
      "read_file",
      "run_command",
      "search_files",
      "write_file"
    ],
    "cli_commands": [
      "crosstest",
      "dashboard",
      "demo",
      "doctor",
      "evolve",
      "memory",
      "models",
      "redteam",
      "resume",
      "run",
      "scar",
      "show",
      "traces",
      "trust",
      "undo",
      "version"
    ],
    "llm_backends": [
      "anthropic",
      "openai_compat",
      "scripted"
    ],
    "default_model": "claude-sonnet-5-5"
  },
  "capability_diff": {
    "added": [],
    "removed": [],
    "changed": []
  },
  "risk_score": 0,
  "escalate": false,
  "priority": "NORMAL",
  "signature": "aa905a99484b28b183822e8bbc3f2c55473e847f5f5bddc454a4c61816af0d51"
}
