{
  "summary": "No changes in last 24h; head = 07f3eab",
  "changes": [],
  "prs": [],
  "security_alerts": [],
  "breaking_changes": [],
  "open_questions": [],
  "pr_previews": [],
  "escalation_reasons": [],
  "report_type": "repo_change_report",
  "seq": 37,
  "source_bot": "GROK-WATCHER",
  "target_bot": "CO-ORDINATOR-BOT",
  "repo": "jonnysteedman683-wq/Sebastian",
  "branch": "main",
  "range": {
    "from_sha": "07f3eab70011c8f133f131e02b2f50b5097ddce8",
    "to_sha": "07f3eab70011c8f133f131e02b2f50b5097ddce8"
  },
  "generated_at": "2026-10-20T00:51:11Z",
  "version": {
    "before": "0.1.0",
    "after": "0.1.0"
  },
  "ci_status": "unknown",
  "capability_inventory": {
    "tools": [
      "edit_file",
      "list_dir",
      "read_file",
      "run_command",
      "search_files",
      "write_file"
    ],
    "cli_commands": [
      "dashboard",
      "demo",
      "evolve",
      "models",
      "redteam",
      "resume",
      "run",
      "scar",
      "traces",
      "undo",
      "version"
    ],
    "llm_backends": [
      "anthropic",
      "openai_compat",
      "scripted"
    ],
    "default_model": "claude-sonnet-5-5"
  },
  "capability_diff": {
    "added": [],
    "removed": [],
    "changed": []
  },
  "risk_score": 0,
  "escalate": false,
  "priority": "LOW",
  "signature": "e546c27156113a95020bbee46095a69cfc036559ae181db05152cac3b5640c35"
}
