{
  "summary": "2 commit(s): feat: add sebastian traces CLI command (B5); Merge pull request #10 from jonnysteedman683-wq/claude/sebastian-upgrade-x7dl17",
  "changes": [
    {
      "category": "NEW_FEATURE",
      "title": "New CLI command traces",
      "description": "Detected automatically from code: New CLI command traces.",
      "impact": "unclear (mechanical draft; not reviewed by the watcher)",
      "evidence": [
        {
          "sha": "15cbe622ae8e67155a6f2612288abb885622ddd9",
          "path": "src/sebastian/cli.py"
        }
      ],
      "permission": "n/a",
      "flags": []
    }
  ],
  "prs": [],
  "security_alerts": [],
  "breaking_changes": [],
  "open_questions": [
    "Mechanical draft (no draft service configured): descriptions come from computed capability changes and commit messages and were not reviewed by the watcher."
  ],
  "pr_previews": [],
  "escalation_reasons": [],
  "report_type": "repo_change_report",
  "seq": 6,
  "source_bot": "GROK-WATCHER",
  "target_bot": "CO-ORDINATOR-BOT",
  "repo": "jonnysteedman683-wq/Sebastian",
  "branch": "main",
  "range": {
    "from_sha": "0246a33c7f798df4fd93f5fd63d7b1155fa55e44",
    "to_sha": "15cbe622ae8e67155a6f2612288abb885622ddd9"
  },
  "generated_at": "2026-10-18T14:56:40Z",
  "version": {
    "before": "0.1.0",
    "after": "0.1.0"
  },
  "ci_status": "unknown",
  "capability_inventory": {
    "tools": [
      "list_dir",
      "read_file",
      "run_command",
      "search_files",
      "write_file"
    ],
    "cli_commands": [
      "demo",
      "run",
      "traces",
      "version"
    ],
    "llm_backends": [
      "anthropic",
      "scripted"
    ],
    "default_model": "claude-sonnet-5-5"
  },
  "capability_diff": {
    "added": [
      "cli: traces"
    ],
    "removed": [],
    "changed": []
  },
  "risk_score": 0,
  "escalate": false,
  "priority": "NORMAL",
  "signature": "a397789ec983001c3417bfaecfc71f91453c26d72d3c13b6e5d3eb89c857209b"
}
