{
  "summary": "No changes in last 24h; head = 08bf2b0",
  "changes": [],
  "prs": [],
  "security_alerts": [],
  "breaking_changes": [],
  "open_questions": [],
  "pr_previews": [],
  "escalation_reasons": [],
  "report_type": "repo_change_report",
  "seq": 47,
  "source_bot": "GROK-WATCHER",
  "target_bot": "CO-ORDINATOR-BOT",
  "repo": "jonnysteedman683-wq/Sebastian",
  "branch": "main",
  "range": {
    "from_sha": "08bf2b0ad3b9b79b8d1cb24f2b78d529663880ef",
    "to_sha": "08bf2b0ad3b9b79b8d1cb24f2b78d529663880ef"
  },
  "generated_at": "2026-10-21T00:16:35Z",
  "version": {
    "before": "0.1.0",
    "after": "0.1.0"
  },
  "ci_status": "unknown",
  "capability_inventory": {
    "tools": [
      "edit_file",
      "list_dir",
      "read_file",
      "run_command",
      "search_files",
      "write_file"
    ],
    "cli_commands": [
      "dashboard",
      "demo",
      "evolve",
      "models",
      "redteam",
      "resume",
      "run",
      "scar",
      "show",
      "traces",
      "undo",
      "version"
    ],
    "llm_backends": [
      "anthropic",
      "openai_compat",
      "scripted"
    ],
    "default_model": "claude-sonnet-5-5"
  },
  "capability_diff": {
    "added": [],
    "removed": [],
    "changed": []
  },
  "risk_score": 0,
  "escalate": false,
  "priority": "LOW",
  "signature": "0940e1730df311a378a33c2bcd8673b015f0e55e8203aa8c40f102664f3dcd70"
}
