{
  "summary": "2 commit(s): test: add tests for Usage type; Merge pull request #83 from jonnysteedman683-wq/jules-3835871699854130540-9a551cd1",
  "changes": [
    {
      "category": "ABILITY_CHANGE",
      "title": "2 file(s) changed",
      "description": "Detected automatically from code: 2 file(s) changed.",
      "impact": "unclear (mechanical draft; not reviewed by the watcher)",
      "evidence": [
        {
          "sha": "521aed6a651731953360e408a96f6c318ffe2e1c",
          "path": "pr_description.md"
        }
      ],
      "permission": "n/a",
      "flags": []
    }
  ],
  "prs": [],
  "security_alerts": [],
  "breaking_changes": [],
  "open_questions": [
    "Mechanical draft (no draft service configured): descriptions come from computed capability changes and commit messages and were not reviewed by the watcher."
  ],
  "pr_previews": [],
  "escalation_reasons": [],
  "report_type": "repo_change_report",
  "seq": 102,
  "source_bot": "GROK-WATCHER",
  "target_bot": "CO-ORDINATOR-BOT",
  "repo": "jonnysteedman683-wq/Sebastian",
  "branch": "main",
  "range": {
    "from_sha": "20a40da7695802dfef8ce2e5b32a5696f0b7d554",
    "to_sha": "521aed6a651731953360e408a96f6c318ffe2e1c"
  },
  "generated_at": "2026-10-30T15:15:28Z",
  "version": {
    "before": "0.1.0",
    "after": "0.1.0"
  },
  "ci_status": "unknown",
  "capability_inventory": {
    "tools": [
      "edit_file",
      "list_dir",
      "read_file",
      "run_command",
      "search_files",
      "write_file"
    ],
    "cli_commands": [
      "crosstest",
      "dashboard",
      "demo",
      "doctor",
      "evolve",
      "memory",
      "models",
      "redteam",
      "resume",
      "run",
      "scar",
      "show",
      "traces",
      "trust",
      "undo",
      "version"
    ],
    "llm_backends": [
      "anthropic",
      "openai_compat",
      "scripted"
    ],
    "default_model": "claude-sonnet-5-5"
  },
  "capability_diff": {
    "added": [],
    "removed": [],
    "changed": []
  },
  "risk_score": 0,
  "escalate": false,
  "priority": "NORMAL",
  "signature": "ad1551c4a57f4a895126b708642d6aaa37306bbd412aa13dd2ae95d89bf18935"
}
